{
 "run_id": "r-S1-1-U0",
 "scenario": "S1",
 "seed": 1,
 "universe": "U0",
 "config_sha256": "7be4f7c54aad61e4c90ca996bbde546796c2f1c834249d2f740a0695568b147a",
 "sim_version": "dev",
 "metrics": {
  "peak_queue": 29.0,
  "excess_retries": 848.0,
  "recovery_time_s": null,
  "unique_success": 56387.0,
  "duplicate_commits": 0.0,
  "peak_switch_checks_per_s": 0.0,
  "switch_checks_total": 0.0,
  "switch_checks_per_unknown": null,
  "unknowns_total": 0.0,
  "median_resolve_s": null,
  "p95_resolve_s": null,
  "escalated": 0.0,
  "harmful_failovers": 0.0,
  "tat_breaches": 0.0,
  "goodput_min_frac": 0.9472090441102251
 },
 "ground_truth": [
  {
   "incident_id": "gt-0",
   "onset_ms": 207647,
   "end_ms": 350433,
   "level": "platform",
   "psp": "*",
   "bank": "*",
   "kind": "surge",
   "magnitude": 1.4543545426893765,
   "is_incident": false
  }
 ],
 "files": {
  "events": "events.jsonl",
  "ground_truth": "ground_truth.json",
  "timeseries": "timeseries.json"
 }
}